{
  "$schema": "http://json-schema.org/draft-07/schema#",
  "$id": "https://github.com/mythos-agent/mythos-agent/benchmarks/cve-replay/schema.json",
  "title": "CVE Replay Case",
  "description": "A single real-world CVE case used by the mythos-agent CVE replay harness.",
  "type": "object",
  "required": [
    "ghsa_id",
    "repo",
    "ecosystem",
    "vulnerable_commit",
    "fix_commit",
    "expected_finding",
    "published_at"
  ],
  "properties": {
    "ghsa_id": {
      "type": "string",
      "pattern": "^GHSA-[a-z0-9]{4}-[a-z0-9]{4}-[a-z0-9]{4}$",
      "description": "Canonical GitHub Security Advisory id."
    },
    "cve_id": {
      "type": "string",
      "pattern": "^CVE-\\d{4}-\\d{4,7}$",
      "description": "Cross-reference CVE id, if assigned."
    },
    "repo": {
      "type": "string",
      "format": "uri",
      "description": "Git clone URL of the vulnerable upstream project."
    },
    "ecosystem": {
      "type": "string",
      "enum": ["npm", "pypi", "go", "rubygems", "nuget", "maven", "crates", "composer"]
    },
    "vulnerable_commit": {
      "type": "string",
      "pattern": "^[0-9a-f]{40}$",
      "description": "40-char SHA of a commit that contains the vulnerability."
    },
    "fix_commit": {
      "type": "string",
      "pattern": "^[0-9a-f]{40}$",
      "description": "40-char SHA of the commit that introduces the patch."
    },
    "expected_finding": {
      "type": "object",
      "required": ["rule_class", "file_hint", "severity"],
      "properties": {
        "rule_class": {
          "type": "string",
          "minLength": 3,
          "description": "Substring that must appear in the scanner's rule id for this finding."
        },
        "file_hint": {
          "type": "string",
          "minLength": 3,
          "description": "Path substring that finding.location.file must end with."
        },
        "severity": {
          "type": "string",
          "enum": ["critical", "high", "medium", "low", "info"]
        }
      },
      "additionalProperties": false
    },
    "cwe": {
      "type": "string",
      "pattern": "^CWE-\\d+$"
    },
    "published_at": {
      "type": "string",
      "format": "date",
      "description": "Advisory publication date (YYYY-MM-DD)."
    },
    "notes": {
      "type": "string",
      "maxLength": 2000
    },
    "require_catch": {
      "type": "boolean",
      "default": false,
      "description": "If true, CI fails when the scanner misses this case or flags the fix-commit version. Flip to true only after manually verifying the case catches today — observational cases (default) simply report truth without gating."
    },
    "calibration_target": {
      "type": "object",
      "description": "Optional. Used by the variants v2 calibration harness (src/analysis/calibration/) to anchor A2's AST matcher against the upstream vulnerable code. Only the cases the calibration corpus covers populate this field; observational cases leave it absent.",
      "required": ["file", "lines"],
      "properties": {
        "file": {
          "type": "string",
          "minLength": 3,
          "description": "Path of the vulnerable file relative to the upstream repo root (e.g. 'internal/re.js')."
        },
        "lines": {
          "type": "array",
          "minItems": 2,
          "maxItems": 2,
          "items": { "type": "integer", "minimum": 1 },
          "description": "1-based [startLine, endLine] band that contains the vulnerable code in the vulnerable_commit. The calibration matcher must hit at least one node whose line range overlaps this band."
        },
        "note": {
          "type": "string",
          "maxLength": 500,
          "description": "Free-text rationale for the chosen line band (e.g. 'lines 138, 148, 160-161 are the three TRIM regex tokens with \\\\s* adjacent to ${} interpolation')."
        }
      },
      "additionalProperties": false
    }
  },
  "additionalProperties": false
}
