{
  "ghsa_id": "GHSA-hjrf-2m68-5959",
  "cve_id": "CVE-2022-23541",
  "repo": "https://github.com/auth0/node-jsonwebtoken.git",
  "ecosystem": "npm",
  "vulnerable_commit": "5eaedbf2b01676d952336e73b4d2efba847d2d1b",
  "fix_commit": "e1fa9dcc12054a8681db4e6373da1b30cf7016e3",
  "expected_finding": {
    "rule_class": "jwt",
    "file_hint": "verify.js",
    "severity": "medium"
  },
  "cwe": "CWE-287",
  "published_at": "2022-12-22",
  "notes": "jsonwebtoken accepted a public key as an HMAC secret when the `secretOrPublicKey` argument was controllable, allowing an attacker to forge HS256 tokens signed with a known public key. Observational: JwtScanner's rules today target JWT *usage* patterns (none algorithm, decode-without-verify, localStorage) rather than *implementation* bugs inside jsonwebtoken itself. Catching this specific CVE would need a new rule targeting `key.type === 'public'` checks absent in sign/verify paths — not currently in scope."
}
