{
  "ghsa_id": "GHSA-cxjh-pqwp-8mfp",
  "cve_id": "CVE-2024-28849",
  "repo": "https://github.com/follow-redirects/follow-redirects.git",
  "ecosystem": "npm",
  "vulnerable_commit": "8526b4a1b2ab3a2e4044299377df623a661caa76",
  "fix_commit": "c4f847f85176991f95ab9c88af63b1294de8649b",
  "expected_finding": {
    "rule_class": "incomplete-redirect-header-strip",
    "file_hint": "index.js",
    "severity": "medium"
  },
  "cwe": "CWE-200",
  "published_at": "2024-03-14",
  "notes": "follow-redirects forwarded the Proxy-Authorization header across hosts on redirect, leaking credentials to a third-party origin. Caught by the RedirectHeadersScanner introduced as part of the scanner #2 PR: the scanner flags any regex literal that strips authorization/cookie on redirect but omits proxy-authorization, gated by a redirect-context proximity check to avoid false-positive on generic auth middleware."
}
