{
  "ghsa_id": "GHSA-9wv6-86v2-598j",
  "cve_id": "CVE-2024-45296",
  "repo": "https://github.com/pillarjs/path-to-regexp.git",
  "ecosystem": "npm",
  "vulnerable_commit": "ac4c2345622a10a09c7ec229e3c29740935d67d7",
  "fix_commit": "29b96b4a1de52824e1ca0f49a701183cc4ed476f",
  "expected_finding": {
    "rule_class": "redos",
    "file_hint": "index.js",
    "severity": "high"
  },
  "cwe": "CWE-1333",
  "published_at": "2024-09-09",
  "notes": "path-to-regexp produced a regex that backtracked catastrophically on crafted path segments. Observational case: the vulnerable regex is constructed dynamically at runtime, so RedosScanner (which matches static regex literals) is unlikely to catch it directly. This case documents a known coverage gap — improving RedosScanner to flag dynamic regex construction from user-controlled patterns would close it."
}
