{
  "ghsa_id": "GHSA-35jh-r3h4-6jhm",
  "cve_id": "CVE-2021-23337",
  "repo": "https://github.com/lodash/lodash.git",
  "ecosystem": "npm",
  "vulnerable_commit": "ded9bc66583ed0b4e3b7dc906206d40757b4a90a",
  "fix_commit": "3469357cff396a26c363f8c1b5a91dde28ba4b1c",
  "expected_finding": {
    "rule_class": "injection",
    "file_hint": "lodash.js",
    "severity": "high"
  },
  "cwe": "CWE-94",
  "published_at": "2021-05-06",
  "notes": "lodash's template() function evaluated template options as code, enabling command/script injection when options were attacker-controlled. Observational. mythos-agent has a command-injection-scanner; verify against its actual rule output. If it catches, flip to require_catch: true."
}
