{
  "ghsa_id": "GHSA-xxxx-xxxx-xxxx",
  "cve_id": "CVE-YYYY-NNNNN",
  "repo": "https://github.com/org/repo.git",
  "ecosystem": "npm",
  "vulnerable_commit": "0000000000000000000000000000000000000000",
  "fix_commit": "1111111111111111111111111111111111111111",
  "expected_finding": {
    "rule_class": "redos",
    "file_hint": "lib/index.js",
    "severity": "high"
  },
  "cwe": "CWE-1333",
  "published_at": "2026-01-01",
  "notes": "Template — copy to cases/GHSA-<your-id>.json and fill with real values. The rule_class must be a substring of the actual rule id produced by a wired scanner (see src/scanner/*.ts). The file_hint must be a real path that exists in the vulnerable commit. Verify manually before committing."
}
