{
  "ghsa_id": "GHSA-c2qf-rxjj-qqgw",
  "cve_id": "CVE-2022-25883",
  "repo": "https://github.com/npm/node-semver.git",
  "ecosystem": "npm",
  "vulnerable_commit": "2f738e9a70d9b9468b7b69e9ed3e12418725c650",
  "fix_commit": "717534ee353682f3bcf33e60a8af4292626d4441",
  "expected_finding": {
    "rule_class": "redos",
    "file_hint": "internal/re.js",
    "severity": "high"
  },
  "cwe": "CWE-1333",
  "published_at": "2023-06-21",
  "notes": "semver's regex for version ranges (in internal/re.js) was vulnerable to catastrophic backtracking on crafted whitespace-padded version strings. This is one of the stronger candidates for RedosScanner to catch: the vulnerable patterns are defined in internal/re.js as static regex source strings (new RegExp(src[...])). Observational — verify what rule_class actually matches before flipping to require_catch."
}
